search_query,max results,title,channel,description,url
kid rhyme,50,Nursery Rhymes for Kids | Songs Compilation - Itsy Bitsy Spider + More Children Songs,Twinkle Little Songs - Nursery Rhymes,"Itsy Bitsy Spider and many more children songs! Enjoy this compilation of fun kids' songs and nursery rhymes for children, brought ...","{'kind': 'youtube#video', 'videoId': '5gZOYKHXwyQ'}"
kid rhyme,50,Wheels on the Bus | @CoComelon Nursery Rhymes &amp; Kids Songs,Cocomelon - Nursery Rhymes,Bounce along in the bus all over town with this favorite nursery rhyme!,"{'kind': 'youtube#video', 'videoId': 'e_04ZrNroTo'}"
kid rhyme,50,5 Little Ducks(Learn Colors Song) | Lalafun Nursery Rhymes &amp; Kids Songs,Lalafun - Nursery Rhymes,Meet our 5 colorful ducks in their new duck house! Perfect for little babies to learn colors and sing along! Lyrics: yellow...,"{'kind': 'youtube#video', 'videoId': 'N5YSbaUl9Y4'}"
kid rhyme,50,Humpty Dumpty Grocery Store | CoComelon Nursery Rhymes &amp; Kids Songs,Cocomelon - Nursery Rhymes,Look at Humpty Dumpty bounce and roll! Nina goes on an epic chase after losing her plastic toy egg from the vending machine in ...,"{'kind': 'youtube#video', 'videoId': 'hxOApe1P9dM'}"
kid rhyme,50,Rabbit Went Over The Mountain | Nursery Rhymes &amp; Kids Songs | NuNu Tv #childrensongs #toddlersongs,NuNu Tv - Nursery Rhymes ,Subscribe For New Kids Songs Every Week ▻▻ https://www.youtube.com/c/NuNuTVNurseryRhymes?sub_confirmation=1 ...,"{'kind': 'youtube#video', 'videoId': 'ibpP7w5MY_o'}"
kid rhyme,50,Name the Color | Nursery Rhymes &amp; Kids Songs | NuNu Tv  #childrensongs #toddlersongs #babysongs,NuNu Tv - Nursery Rhymes ,Subscribe For New Kids Songs Every Week ▻▻ https://www.youtube.com/c/NuNuTVNurseryRhymes?sub_confirmation=1 ...,"{'kind': 'youtube#video', 'videoId': 'ZesVTSG-z_4'}"
kid rhyme,50,Train Choo Choo Song | Newborn Baby Songs &amp; Nursery Rhymes,Little LaLa's Nursery Rhymes,Sing along and learn with Lalafun to the new 'Train Choo Choo Song'! Train Choo Choo Song | Newborn Baby Songs & Nursery ...,"{'kind': 'youtube#video', 'videoId': 'kWeBeop7gW0'}"
kid rhyme,50,Humpty Dumpty Nursery Rhyme -  Learn From Your Mistakes!,ChuChu TV Nursery Rhymes & Kids Songs,Get the cute Baby Taku's Toy Bestie Plush at the ChuChu TV Store. It's great for cuddles and fun for your kids! Buy yours today!,"{'kind': 'youtube#video', 'videoId': 'AIIj0mBX1jU'}"
kid rhyme,50,The Cows in the Cornfield Rhyme Song | Popular Nursery Rhyme | Educational Kids Songs,Dumboo,"Sing along to ""The Cows in the Cornfield,"" a delightful nursery rhyme that brings the countryside to life! Join the cows as they ...","{'kind': 'youtube#video', 'videoId': 'RPVpS3OMFVY'}"
kid rhyme,50,Five Little Monkeys Jumping On The Bed | Children Nursery Rhyme | Flickbox Kids Songs,Little BoBo Nursery Rhymes - FlickBox Studios,"FlickBox presents 5 Little Monkeys, a popular children's rhyme about five naughty monkeys who jump on the bed and get into ...","{'kind': 'youtube#video', 'videoId': 'b0NHrFNZWh0'}"
kid rhyme,50,Five Little Ducks + More | Kids Songs and Nursery Rhymes | Super Simple Songs,Super Simple Songs - Kids Songs,"Get the Super Simple App! ▻ http://bit.ly/TheSuperSimpleApp Five little ducks went out one day, and you'll never guess what ...","{'kind': 'youtube#video', 'videoId': 'LrAtBtQnvCE'}"
kid rhyme,50,Top 25 Most Popular Nursery Rhymes I Kids Rhymes With Actions I Johnny Johnny Yes Papa #kidsvideo,Kids Carnival,Top 25 Most Popular Nursery Rhymes I Kids Rhymes With Actions I Johnny Johnny Yes Papa #kidsvideo 00:13 - Twinkle Twinkle ...,"{'kind': 'youtube#video', 'videoId': 'ntZTXEBVx7g'}"
kid rhyme,50,Old MacDonald Song with Safari Animals | Lalafun Nursery Rhymes &amp; Kids Songs,Lalafun - Nursery Rhymes,"Old MacDonald meets safari animals like lions, zebras, and elephants on his wild farm! Lyrics: ""Old MacDonald had a farm ...","{'kind': 'youtube#video', 'videoId': 'drkOBuiGPCM'}"
kid rhyme,50,आहा टमाटर - Aaha Tamatar Bade Mazedar - Nursery Rhymes and Kids Song in Hindi  Anaya Rhymes #cartoon,RIYA KIDS TV,आहा टमाटर - Aaha Tamatar Bade Mazedar - Nursery Rhymes and Kids Song in Hindi Anaya Rhymes #cartoon #riyakidstv ...,"{'kind': 'youtube#video', 'videoId': '6rRRAVSilss'}"
kid rhyme,50,Daddy Finger Daddy Finger | Nursery Rhymes &amp; Kids Songs | NuNu Tv  #childrensongs #toddlersongs,NuNu Tv - Nursery Rhymes ,Subscribe For New Kids Songs Every Week ▻▻ https://www.youtube.com/c/NuNuTVNurseryRhymes?sub_confirmation=1 ...,"{'kind': 'youtube#video', 'videoId': '69oBaY-PBOY'}"
kid rhyme,50,Monster Police 🧟🚨 | Kids Songs &amp; Nursery Rhymes | Baby Blue,Minibus - Nursery Rhymes & Kids Songs,"Baby Blue will take your little ones on magical adventures with friendly monsters, thrilling challenges, and magical moments ...","{'kind': 'youtube#video', 'videoId': '8anZWMbSv5U'}"
kid rhyme,50,"ChuChu TV Classics - Head, Shoulders, Knees &amp; Toes Exercise Song + More Popular Baby Nursery Rhymes",ChuChu TV Nursery Rhymes & Kids Songs,Get the cute Baby Taku's Toy Bestie Plush at the ChuChu TV Store. It's great for cuddles and fun for your kids! Buy yours today!,"{'kind': 'youtube#video', 'videoId': 'VXokId-v7oU'}"
kid rhyme,50,Good manner | Nursery Rhymes &amp; Toddlers Songs | NuNu Tv #childrensongs #toddlersongs #singalong,NuNu Tv - Nursery Rhymes ,Subscribe For New Kids Songs Every Week ▻▻ https://www.youtube.com/c/NuNuTVNurseryRhymes?sub_confirmation=1 ...,"{'kind': 'youtube#video', 'videoId': 'fAM-llmD7ZY'}"
kid rhyme,50,Circle Square &amp; Triangle | Nursery Rhymes for toddlers | NuNu Tv  #childrensongs #toddlersongs,NuNu Tv - Nursery Rhymes ,Subscribe For New Kids Songs Every Week ▻▻ https://www.youtube.com/c/NuNuTVNurseryRhymes?sub_confirmation=1 ...,"{'kind': 'youtube#video', 'videoId': 'OSa2NBaFbZk'}"
kid rhyme,50,Old MacdDonald Had A Farm + More Kidsberry Nursery Rhymes &amp; Baby Songs,Kidsberry - Nursery Rhymes ♫ ,"Watch our latest compilation ""Old MacDonald Had a Farm"" which is a traditional children's song and nursery rhyme about a farmer ...","{'kind': 'youtube#video', 'videoId': '6FVLPV4HmBo'}"
kid rhyme,50,Catch the Lollipop | Finger Family Song | Lalafun Nursery Rhymes &amp; Kids Songs,Lalafun - Nursery Rhymes,"Baby catches lollipops! Sing along with the Finger Family! Lyrics: Daddy finger, Daddy finger, where are you? Here I am ...","{'kind': 'youtube#video', 'videoId': '-MZy8FqUw9c'}"
kid rhyme,50,Who Took The Cookie? | Nursery Rhyme | Super Simple Songs,Super Simple Songs - Kids Songs,"Get the Super Simple App! ▻ http://bit.ly/TheSuperSimpleApp Enjoy ""Who Took The Cookie?"", a classic rhyme with original music ...","{'kind': 'youtube#video', 'videoId': 'OzKY5YHnOTg'}"
kid rhyme,50,BINGO | Nursery Rhymes For Kids | Super Simple Songs,Super Simple Songs - Kids Songs,"Get the Super Simple App! ▻ http://bit.ly/TheSuperSimpleApp We've added a Super Simple twist to ""BINGO"" by adding actions ...","{'kind': 'youtube#video', 'videoId': '9mmF8zOlh_g'}"
kid rhyme,50,Ten Little Buses | Nursery Rhymes &amp; Toddler Song | NuNu Tv  #childrensongs  #singalong #babysong,NuNu Tv - Nursery Rhymes ,Subscribe For New Kids Songs Every Week ▻▻ https://www.youtube.com/c/NuNuTVNurseryRhymes?sub_confirmation=1 ...,"{'kind': 'youtube#video', 'videoId': 'LwBcZeaLx5c'}"
kid rhyme,50,Baby Shark | @CoComelon Nursery Rhymes &amp; Kids Songs,Cocomelon - Nursery Rhymes,"Subscribe for new videos every week: https://www.youtube.com/c/Cocomelon?sub_confirmation=1 Lyrics: Baby Shark, do do do ...","{'kind': 'youtube#video', 'videoId': '020g-0hhCAU'}"
kid rhyme,50,Ten Little Airplanes | Nursery Rhymes &amp; Toddler Song | NuNu Tv  #childrensongs  #singalong #babysong,NuNu Tv - Nursery Rhymes ,Subscribe For New Kids Songs Every Week ▻▻ https://www.youtube.com/c/NuNuTVNurseryRhymes?sub_confirmation=1 ...,"{'kind': 'youtube#video', 'videoId': 'HTx-MIgz0-s'}"
kid rhyme,50,Humpty Dumpty | + More Kids Songs | Super Simple Songs,Super Simple Songs - Kids Songs,Get the Super Simple App! ▻ http://bit.ly/TheSuperSimpleApp Invite your friends and enjoy this collection of modern kids songs ...,"{'kind': 'youtube#video', 'videoId': '0n_J2z-ILXo'}"
kid rhyme,50,Finger Family Song | Learn Colors | Nursery Rhymes &amp; Kids Songs | NuNu Tv,NuNu Tv - Nursery Rhymes ,Subscribe For New Kids Songs Every Week ▻▻ https://www.youtube.com/c/NuNuTVNurseryRhymes?sub_confirmation=1 Finger ...,"{'kind': 'youtube#video', 'videoId': 'SEhRdrz4irk'}"
kid rhyme,50,Happy &amp; You Know It | CoComelon Animal Time - Learning with Animals | Nursery Rhymes for Kids,CoComelon Animal Time - Learning with Animals,"JJ, YoYo and their animal friends have a fun time blowing bubbles, JJ finds himself having “big feelings.” Thankfully, YoYo and his ...","{'kind': 'youtube#video', 'videoId': 'x7T4xOaiyX0'}"
kid rhyme,50,Counting 10 Little Pandas | Lalafun Nursery Rhymes &amp; Kids Songs,Lalafun - Nursery Rhymes,"Count from 1 to 10 with little pandas, monkeys, bunnies, hippos, and bears as they play in fun places like a house, pool, and ...","{'kind': 'youtube#video', 'videoId': 'LJy82OLdlwQ'}"
kid rhyme,50,Good Manner Song | Nursery Rhymes &amp; Kids Songs | NuNu Tv  #childrensongs #toddlersongs,NuNu Tv - Nursery Rhymes ,Subscribe For New Kids Songs Every Week ▻▻ https://www.youtube.com/c/NuNuTVNurseryRhymes?sub_confirmation=1 ...,"{'kind': 'youtube#video', 'videoId': 'S8ht0tjOois'}"
kid rhyme,50,"Rain, Rain, Go Away (Farm Version) +More Lalafun Nursery Rhymes &amp; Kids Songs",Lalafun - Nursery Rhymes,Sing along with us! Rain rain go away Come again another day Neigh- neigh the horses say Rain rain go away Daddy Horse do ...,"{'kind': 'youtube#video', 'videoId': 'PydLlpuRIr0'}"
kid rhyme,50,Wheels On The Car | Baby Dont Cry  + More Nursery Rhymes &amp; Kids Songs | NuNu TV,NuNu Tv - Nursery Rhymes ,Subscribe For New Kids Songs Every Week ▻▻ https://www.youtube.com/c/NuNuTVNurseryRhymes?sub_confirmation=1 ...,"{'kind': 'youtube#video', 'videoId': 'WEgY8qt9Zvo'}"
kid rhyme,50,Ding Dong Bell |  Nursery Rhymes &amp; Kids Songs | #shorts #childrensongs #animation #youtubeshorts,Videogyan 3D Nursery Rhymes & Kids Songs,Get ready to sing and dance with our engaging nursery rhyme animated shorts by Videogyan! Our collection of classic nursery ...,"{'kind': 'youtube#video', 'videoId': '6qWMVkDhe4I'}"
kid rhyme,50,Wheels On The Bus Go To Town | Nursery Rhymes &amp; Kids Songs - Baby Car Songs TV,Baby Car Songs TV,babycar #kidssong #nurseryrhymes Wheels On The Bus Go To Town | Nursery Rhymes & Kids Songs - Baby Car Songs TV THE ...,"{'kind': 'youtube#video', 'videoId': '9uTBSRUIVLI'}"
kid rhyme,50,Incy Wincy Spider and More Nursery Rhymes for children! | Children Songs | Toddler Fun Learning,Toddler Fun Learning,Watch cute Incy Wincy Spider in this Itsy Bitsy Spider Nursery Rhyme and more nursery rhymes for children. Watch him climb the ...,"{'kind': 'youtube#video', 'videoId': 'buE6l32rCHo'}"
kid rhyme,50,If You Are Happy + More Nursery Rhymes &amp; Baby Songs - Kidsberry,Kidsberry - Nursery Rhymes ♫ ,Watch our latest Compilation and enjoy with Jinnie and Johny and learn the most popular nursery rhymes Subscribe for more ...,"{'kind': 'youtube#video', 'videoId': 'Xjzzu4ZwCe8'}"
kid rhyme,50,गाड़ी आयी छुक छुक - Full rhyme in Hindi | Gadi Aayi Gadi Aayi Chuk Chuk Rhyme | Kids rhyme in hindi,Coco TV Rhymes,गाड़ी आयी छुक छुक - Full rhyme in Hindi | Gadi Aayi Gadi Aayi Chuk Chuk Rhyme | Kids rhyme in hindi #gadiaayi ...,"{'kind': 'youtube#video', 'videoId': 'PtRtvLYRGtk'}"
kid rhyme,50,Walking WalkingㅣNursery Rhymes for KidsㅣDance along Bebefinn,Bebefinn - Nursery Rhymes & Kids Songs,Subscribe and watch full version of the songs uploaded every week. ☆ YouTube Channel: ...,"{'kind': 'youtube#video', 'videoId': 'l_qyieStjMI'}"
kid rhyme,50,Rain Rain Go Away with Zoo Friends! 🐘 + MORE Lalafun Nursery Rhymes &amp; Kids Songs,Lalafun - Nursery Rhymes,"Zoo animals want to play, rain rain go away! 🌧️       Lyrics: Rain, rain, go away. Come again another day. Elephant wants to ...","{'kind': 'youtube#video', 'videoId': 'MN0GdKMJAfk'}"
kid rhyme,50,Five Little Monkeys Jumping on the bed - 3D Animation English Nursery rhyme for children,CVS 3D Rhymes & Kids Songs,"""Five Little Monkeys Jumping on the bed"" - 3D Animation English Nursery rhyme for children. 5 Little Monkeys Jumping on the bed ...","{'kind': 'youtube#video', 'videoId': 'LrM62pv56o0'}"
kid rhyme,50,The Tiny Ants Go Marching Song + MORE Lalafun Nursery Rhymes &amp; Kids Songs,Lalafun - Nursery Rhymes,"The tiny ants go marching one by one, singing and collecting tasty treats along the way! Lyrics: The ants go marching one ...","{'kind': 'youtube#video', 'videoId': '4edz2UIo-D8'}"
kid rhyme,50,Rain Rain Go Away | Nursery Rhymes &amp; Kids Songs | NuNu Tv  #toddlersongs #childrensongs #singalong,NuNu Tv - Nursery Rhymes ,Subscribe For New Kids Songs Every Week ▻▻ https://www.youtube.com/c/NuNuTVNurseryRhymes?sub_confirmation=1 ...,"{'kind': 'youtube#video', 'videoId': 'xC7yZSD6dgs'}"
kid rhyme,50,Endangered Animals Part-1 #animalshorts #kidsshorts #kidslearning #elephant #animals #kidsfun #funny,ChuChu TV Nursery Rhymes & Kids Songs,Get the cute Baby Taku's Toy Bestie Plush at the ChuChu TV Store. It's great for cuddles and fun for your kids! Buy yours today!,"{'kind': 'youtube#video', 'videoId': 't4j8JWKGjVY'}"
kid rhyme,50,Bingo | Nursery Rhymes &amp; Kids Songs | NuNu Tv #kindergartensong #babysongs #kidssongs #nurseryrhymes,NuNu Tv - Nursery Rhymes ,Subscribe For New Kids Songs Every Week ▻▻ https://www.youtube.com/c/NuNuTVNurseryRhymes?sub_confirmation=1 ...,"{'kind': 'youtube#video', 'videoId': 'D-6bos_17e4'}"
kid rhyme,50,Yes Mama Yes Papa + More Nursery Rhymes &amp; Kids Songs | NuNu Tv,NuNu Tv - Nursery Rhymes ,"Does the baby eat a lollipop? Baby, open your mouth!Let's sing along heart touching ""Yes Mama Yes Papa song and compilation ...","{'kind': 'youtube#video', 'videoId': 'H7V9oDPx2h8'}"
kid rhyme,50,Down In The Jungle! And lots more Nursery Rhymes! 75 minutes!,Sing and Learn,Downloads are now available at https://wayokids.com/p/nursery-rhymes-1-from-sing-and-learn-by-store-176 A 75 minute nursery ...,"{'kind': 'youtube#video', 'videoId': 'gb85n7gSJWo'}"
kid rhyme,50,Old MacDonald Had a Farm (Safari Animals) +MORE Lalafun Nursery Rhymes &amp; Animal Songs,Lalafun - Nursery Rhymes,"Safari animals at Old MacDonald's farm! Lyrics: ""Old MacDonald had a farm Ee I ee i o"" ""And on his farm, he had an ...","{'kind': 'youtube#video', 'videoId': 'ulUXVT7cqbA'}"
kid rhyme,50,Monster in the Dark | Don&#39;t Be Afraid Of Monsters | GoBooBoo Kids Songs &amp; Nursery Rhymes,GoBooBoo - Nursery Rhymes,Monster in the Dark | Don't Be Afraid Of Monsters | GoBooBoo Kids Songs & Nursery Rhymes Subscribe for new videos every ...,"{'kind': 'youtube#video', 'videoId': 'AK7H0z6Dclk'}"
kid rhyme,50,Learn Abc&#39; with NuNu Tv | Abc Song &amp; Nursery Rhymes &amp; Kids Songs  | NuNu Tv  #childrensongs #abcd,NuNu Tv - Nursery Rhymes ,Subscribe For New Kids Songs Every Week ▻▻ https://www.youtube.com/c/NuNuTVNurseryRhymes?sub_confirmation=1 ...,"{'kind': 'youtube#video', 'videoId': 'H93lU-czGvw'}"
kid rhyme nursery rhyme,50,Nursery Rhymes for Kids | Songs Compilation - Itsy Bitsy Spider + More Children Songs,Twinkle Little Songs - Nursery Rhymes,"Itsy Bitsy Spider and many more children songs! Enjoy this compilation of fun kids' songs and nursery rhymes for children, brought ...","{'kind': 'youtube#video', 'videoId': '5gZOYKHXwyQ'}"
kid rhyme nursery rhyme,50,Five Little Ducks + More | Kids Songs and Nursery Rhymes | Super Simple Songs,Super Simple Songs - Kids Songs,"Get the Super Simple App! ▻ http://bit.ly/TheSuperSimpleApp Five little ducks went out one day, and you'll never guess what ...","{'kind': 'youtube#video', 'videoId': 'LrAtBtQnvCE'}"
kid rhyme nursery rhyme,50,Rabbit Went Over The Mountain | Nursery Rhymes &amp; Kids Songs | NuNu Tv #childrensongs #toddlersongs,NuNu Tv - Nursery Rhymes ,Subscribe For New Kids Songs Every Week ▻▻ https://www.youtube.com/c/NuNuTVNurseryRhymes?sub_confirmation=1 ...,"{'kind': 'youtube#video', 'videoId': 'ibpP7w5MY_o'}"
kid rhyme nursery rhyme,50,Wheels on the Bus | @CoComelon Nursery Rhymes &amp; Kids Songs,Cocomelon - Nursery Rhymes,Bounce along in the bus all over town with this favorite nursery rhyme!,"{'kind': 'youtube#video', 'videoId': 'e_04ZrNroTo'}"
kid rhyme nursery rhyme,50,5 Little Ducks(Learn Colors Song) | Lalafun Nursery Rhymes &amp; Kids Songs,Lalafun - Nursery Rhymes,Meet our 5 colorful ducks in their new duck house! Perfect for little babies to learn colors and sing along! Lyrics: yellow...,"{'kind': 'youtube#video', 'videoId': 'N5YSbaUl9Y4'}"
kid rhyme nursery rhyme,50,Name the Color | Nursery Rhymes &amp; Kids Songs | NuNu Tv  #childrensongs #toddlersongs #babysongs,NuNu Tv - Nursery Rhymes ,Subscribe For New Kids Songs Every Week ▻▻ https://www.youtube.com/c/NuNuTVNurseryRhymes?sub_confirmation=1 ...,"{'kind': 'youtube#video', 'videoId': 'ZesVTSG-z_4'}"
kid rhyme nursery rhyme,50,Humpty Dumpty Grocery Store | CoComelon Nursery Rhymes &amp; Kids Songs,Cocomelon - Nursery Rhymes,Look at Humpty Dumpty bounce and roll! Nina goes on an epic chase after losing her plastic toy egg from the vending machine in ...,"{'kind': 'youtube#video', 'videoId': 'hxOApe1P9dM'}"
kid rhyme nursery rhyme,50,Toddler Learning with Ms Rachel - Nursery Rhymes &amp; Kids Songs - Baby Video - Milestones &amp; Speech,Ms Rachel - Toddler Learning Videos,"Have your toddler or baby learn with a real teacher, Ms Rachel! In this special Play Along Video, Ms Rachel encourages ...","{'kind': 'youtube#video', 'videoId': 'h67AgK4EHq4'}"
kid rhyme nursery rhyme,50,A For Apple 🍎🍏 #eductionalvideo #kidsongs #nurseryrhyme #learningpoem,Pompom Rhymes,aforapple #kidsongs #learningpoem #nurseryrhyme #childrenssong #toddlersongs #eductionalvideo #kidslearning #funforkids ...,"{'kind': 'youtube#video', 'videoId': 'OxKRJkaEtJc'}"
kid rhyme nursery rhyme,50,Five Little Monkeys Jumping On The Bed | Children Nursery Rhyme | Flickbox Kids Songs,Little BoBo Nursery Rhymes - FlickBox Studios,"FlickBox presents 5 Little Monkeys, a popular children's rhyme about five naughty monkeys who jump on the bed and get into ...","{'kind': 'youtube#video', 'videoId': 'b0NHrFNZWh0'}"
kid rhyme nursery rhyme,50,Good manner | Nursery Rhymes &amp; Toddlers Songs | NuNu Tv #childrensongs #toddlersongs #singalong,NuNu Tv - Nursery Rhymes ,Subscribe For New Kids Songs Every Week ▻▻ https://www.youtube.com/c/NuNuTVNurseryRhymes?sub_confirmation=1 ...,"{'kind': 'youtube#video', 'videoId': 'fAM-llmD7ZY'}"
kid rhyme nursery rhyme,50,Daddy Finger Daddy Finger | Nursery Rhymes &amp; Kids Songs | NuNu Tv  #childrensongs #toddlersongs,NuNu Tv - Nursery Rhymes ,Subscribe For New Kids Songs Every Week ▻▻ https://www.youtube.com/c/NuNuTVNurseryRhymes?sub_confirmation=1 ...,"{'kind': 'youtube#video', 'videoId': '69oBaY-PBOY'}"
kid rhyme nursery rhyme,50,Humpty Dumpty | + More Kids Songs | Super Simple Songs,Super Simple Songs - Kids Songs,Get the Super Simple App! ▻ http://bit.ly/TheSuperSimpleApp Invite your friends and enjoy this collection of modern kids songs ...,"{'kind': 'youtube#video', 'videoId': '0n_J2z-ILXo'}"
kid rhyme nursery rhyme,50,Top 25 Most Popular Nursery Rhymes I Kids Rhymes With Actions I Johnny Johnny Yes Papa #kidsvideo,Kids Carnival,Top 25 Most Popular Nursery Rhymes I Kids Rhymes With Actions I Johnny Johnny Yes Papa #kidsvideo 00:13 - Twinkle Twinkle ...,"{'kind': 'youtube#video', 'videoId': 'ntZTXEBVx7g'}"
kid rhyme nursery rhyme,50,"ChuChu TV Classics - Head, Shoulders, Knees &amp; Toes Exercise Song + More Popular Baby Nursery Rhymes",ChuChu TV Nursery Rhymes & Kids Songs,Get the cute Baby Taku's Toy Bestie Plush at the ChuChu TV Store. It's great for cuddles and fun for your kids! Buy yours today!,"{'kind': 'youtube#video', 'videoId': 'VXokId-v7oU'}"
kid rhyme nursery rhyme,50,Humpty Dumpty Nursery Rhyme -  Learn From Your Mistakes!,ChuChu TV Nursery Rhymes & Kids Songs,Get the cute Baby Taku's Toy Bestie Plush at the ChuChu TV Store. It's great for cuddles and fun for your kids! Buy yours today!,"{'kind': 'youtube#video', 'videoId': 'AIIj0mBX1jU'}"
kid rhyme nursery rhyme,50,Old MacDonald Song with Safari Animals | Lalafun Nursery Rhymes &amp; Kids Songs,Lalafun - Nursery Rhymes,"Old MacDonald meets safari animals like lions, zebras, and elephants on his wild farm! Lyrics: ""Old MacDonald had a farm ...","{'kind': 'youtube#video', 'videoId': 'drkOBuiGPCM'}"
kid rhyme nursery rhyme,50,Incy Wincy Spider and More Nursery Rhymes for children! | Children Songs | Toddler Fun Learning,Toddler Fun Learning,Watch cute Incy Wincy Spider in this Itsy Bitsy Spider Nursery Rhyme and more nursery rhymes for children. Watch him climb the ...,"{'kind': 'youtube#video', 'videoId': 'buE6l32rCHo'}"
kid rhyme nursery rhyme,50,Ten Little Buses | Nursery Rhymes &amp; Toddler Song | NuNu Tv  #childrensongs  #singalong #babysong,NuNu Tv - Nursery Rhymes ,Subscribe For New Kids Songs Every Week ▻▻ https://www.youtube.com/c/NuNuTVNurseryRhymes?sub_confirmation=1 ...,"{'kind': 'youtube#video', 'videoId': 'LwBcZeaLx5c'}"
kid rhyme nursery rhyme,50,आहा टमाटर - Aaha Tamatar Bade Mazedar - Nursery Rhymes and Kids Song in Hindi  Anaya Rhymes #cartoon,RIYA KIDS TV,आहा टमाटर - Aaha Tamatar Bade Mazedar - Nursery Rhymes and Kids Song in Hindi Anaya Rhymes #cartoon #riyakidstv ...,"{'kind': 'youtube#video', 'videoId': '6rRRAVSilss'}"
kid rhyme nursery rhyme,50,If You Are Happy + More Nursery Rhymes &amp; Baby Songs - Kidsberry,Kidsberry - Nursery Rhymes ♫ ,Watch our latest Compilation and enjoy with Jinnie and Johny and learn the most popular nursery rhymes Subscribe for more ...,"{'kind': 'youtube#video', 'videoId': 'Xjzzu4ZwCe8'}"
kid rhyme nursery rhyme,50,Old MacdDonald Had A Farm + More Kidsberry Nursery Rhymes &amp; Baby Songs,Kidsberry - Nursery Rhymes ♫ ,"Watch our latest compilation ""Old MacDonald Had a Farm"" which is a traditional children's song and nursery rhyme about a farmer ...","{'kind': 'youtube#video', 'videoId': '6FVLPV4HmBo'}"
kid rhyme nursery rhyme,50,Endangered Animals Part-1 #animalshorts #kidsshorts #kidslearning #elephant #animals #kidsfun #funny,ChuChu TV Nursery Rhymes & Kids Songs,Get the cute Baby Taku's Toy Bestie Plush at the ChuChu TV Store. It's great for cuddles and fun for your kids! Buy yours today!,"{'kind': 'youtube#video', 'videoId': 't4j8JWKGjVY'}"
kid rhyme nursery rhyme,50,"Nursery Rhymes and Kids Songs 🎶 ABC Alphabet, Wheels on the Bus, and more family fun! 🎉 The Wiggles",The Wiggles - Kids Songs and Nursery Rhymes,Welcome to the wonderful world of Nursery Rhymes and children's songs! Join The Wiggles on a musical adventure that ...,"{'kind': 'youtube#video', 'videoId': 'se5XcrG4S8s'}"
kid rhyme nursery rhyme,50,Train Choo Choo Song | Newborn Baby Songs &amp; Nursery Rhymes,Little LaLa's Nursery Rhymes,Sing along and learn with Lalafun to the new 'Train Choo Choo Song'! Train Choo Choo Song | Newborn Baby Songs & Nursery ...,"{'kind': 'youtube#video', 'videoId': 'kWeBeop7gW0'}"
kid rhyme nursery rhyme,50,Ding Dong Bell |  Nursery Rhymes &amp; Kids Songs | #shorts #childrensongs #animation #youtubeshorts,Videogyan 3D Nursery Rhymes & Kids Songs,Get ready to sing and dance with our engaging nursery rhyme animated shorts by Videogyan! Our collection of classic nursery ...,"{'kind': 'youtube#video', 'videoId': '6qWMVkDhe4I'}"
kid rhyme nursery rhyme,50,BINGO | Nursery Rhymes For Kids | Super Simple Songs,Super Simple Songs - Kids Songs,"Get the Super Simple App! ▻ http://bit.ly/TheSuperSimpleApp We've added a Super Simple twist to ""BINGO"" by adding actions ...","{'kind': 'youtube#video', 'videoId': '9mmF8zOlh_g'}"
kid rhyme nursery rhyme,50,Monster Police 🧟🚨 | Kids Songs &amp; Nursery Rhymes | Baby Blue,Minibus - Nursery Rhymes & Kids Songs,"Baby Blue will take your little ones on magical adventures with friendly monsters, thrilling challenges, and magical moments ...","{'kind': 'youtube#video', 'videoId': '8anZWMbSv5U'}"
kid rhyme nursery rhyme,50,Finger Family Song | Learn Colors | Nursery Rhymes &amp; Kids Songs | NuNu Tv,NuNu Tv - Nursery Rhymes ,Subscribe For New Kids Songs Every Week ▻▻ https://www.youtube.com/c/NuNuTVNurseryRhymes?sub_confirmation=1 Finger ...,"{'kind': 'youtube#video', 'videoId': 'SEhRdrz4irk'}"
kid rhyme nursery rhyme,50,Walking WalkingㅣNursery Rhymes for KidsㅣDance along Bebefinn,Bebefinn - Nursery Rhymes & Kids Songs,Subscribe and watch full version of the songs uploaded every week. ☆ YouTube Channel: ...,"{'kind': 'youtube#video', 'videoId': 'l_qyieStjMI'}"
kid rhyme nursery rhyme,50,Top 10 - Ten Most Popular Nursery Rhymes Collection Vol. 1 with Lyrics | Kids Videos For Kids,Kids Carnival,Top 10 - Ten Most Popular Nursery Rhymes Collection Vol. 1 with Lyrics | Kids Videos For Kids Watch 10 of the Most Popular ...,"{'kind': 'youtube#video', 'videoId': 'lI2wHDsnk0Q'}"
kid rhyme nursery rhyme,50,Wheels On The Car | Baby Dont Cry  + More Nursery Rhymes &amp; Kids Songs | NuNu TV,NuNu Tv - Nursery Rhymes ,Subscribe For New Kids Songs Every Week ▻▻ https://www.youtube.com/c/NuNuTVNurseryRhymes?sub_confirmation=1 ...,"{'kind': 'youtube#video', 'videoId': 'WEgY8qt9Zvo'}"
kid rhyme nursery rhyme,50,"Rain, Rain, Go Away (Farm Version) +More Lalafun Nursery Rhymes &amp; Kids Songs",Lalafun - Nursery Rhymes,Sing along with us! Rain rain go away Come again another day Neigh- neigh the horses say Rain rain go away Daddy Horse do ...,"{'kind': 'youtube#video', 'videoId': 'PydLlpuRIr0'}"
